{
  "$schema": "../post.schema.json",
  "title": "Scope for Imagination",
  "subtitle": "an ode to slow living",
  "excerpt": "Hi, friend! :) It’s been a while –– years, actually –– since I’ve devoted to some sort of blog/digital journal (or whatever you call these)…",
  "entry": "0001",
  "date": "2026-08-26",
  "time": "15:12",
  "location": "Kansas City, MO",
  "trip": null,
  "thread": null,
  "slug": "0001-scope-for-imagination-an-ode-to-slow-living-20260826",
  "music": {
    "title": "Water & Wanderlust",
    "artist": "Yebba",
    "album": "Jean"
  },
  "tags": [
    "sfi",
    "reflections"
  ],
  "blog": "sfi",
  "collections": [],
  "latitude": null,
  "longitude": null,
  "status": "published",
  "bodyHtml": "<p>Hi, friend! :)</p>\n  <p>It’s been a while –– years, actually –– since I’ve devoted to some sort of blog/digital journal (or whatever you call these). Newsletter? Thought catalogue?</p>\n  <p>The point being, I’ve not written nearly as often as would be helpful for myself, or potentially thought-provoking for readers.</p>\n  <p>I assume, of course, this will be read in some capacity, perhaps if only by close friends and colleagues –– I feel too young to be calling anyone a colleague at twenty-four, though I suppose I do have several already –– which would be more than okay. In either case, I need the outlet.</p>\n\n  <div style=\"display: block; width: 80%; margin: 0 auto;\">\n  <figure>\n    <img src=\"/images/posts/0001-scope-for-imagination-an-ode-to-slow-living-20260826/marcy_dam_LVaug26M1.jpeg\" alt=\"Marcy Dam [Adirondacks of NY]\" />\n    <figcaption>Marcy Dam region of the Adirondack Park, captured by Benson Chang</figcaption>\n  </figure>\n  </div>\n\n  <p>I recently finished a two-week excursion, backpacking in the Adirondack Mountains of New York. During this trip, I connected with both a young artist and another who (should she so choose) would make an incredible anthropologist. In their own respects, they each appealed to an aspect of who I currently understand myself to be.</p>\n  <p>At various summits and on trail, the artist and I would join over cherished song lyrics, comparing sketches and artistic inclinations –– our group found us quite loud. As quickly, the other would raise philosophical inquiries to better understand her own scholarship and socio-ethical duties. I’m honored to have been given any platform to speak into her life, though in answering both of them, I realized afresh how little I know.</p>\n  <p>At times, I find comfort in the practicality this sentiment. It’s the chief scientific position, is it not?</p>\n  <p>Elsewise, it’s infuriating. I loathe not knowing, not having insight where it seems most beneficial.</p>\n  <p>I’ve found conviction in the unlikeliest of places, though. I’m religious, spiritual –– whichever sounds less repulsive to you (more on this later) –– but I also carry four years’ worth of liberal arts education, and I often draw from a variety of sources for my own inspiration. A rendezvous with Lucy Maud Montgomery’s <i>Anne of Green Gables</i> (my favorite book) brought unintended wisdom:</p>\n  <br>\n\n  <div style=\"width: 70%; margin: 0 auto;\">\n    <blockquote>\n    <p><i>\n      Isn&#x27;t it splendid to think of all the things there are to find out about?<br>\n      It just makes me feel glad to be alive - it&#x27;s such an interesting world.<br>\n      It wouldn&#x27;t be half so interesting if we know all about everything, would it?<br>\n      There'd be no <b>scope for imagination</b> then, would there?\n    </i></p>\n    <footer><i>–– Anne of Green Gables, Lucy Maud Montgomery</i></footer>\n    </blockquote>\n  </div>\n  <br>\n\n  <p>Jon Bellion’s <i>Maybe IDK</i> echoes this idea –– not knowing is, at least, okay, and dare I say, purposeful. How else would one be curious enough to search out new insight, new creativity, new anthropology?</p>\n  <p>As both a cognitive scientist and artist (I take photos and sketch and write, I suppose), I am constantly concerned with these things. Whether or not I slow down to properly engage with them at their deserved level is another story…</p>\n  <p>Frequently, it’s exhausting. More often than not, it’s quite life-giving. Occasionally, it amounts to something I think is worth circulating –– once again, if only among close friends and colleagues –– such as this journal, <i>Scope for Imagination</i>.</p>\n  <p>I hope to use this as an outlet for creativity and reflection, something to balance out my academic efforts. I picked the name, initially, as the reprise of a Wix “blog” (if I can call it that after only ~three entries) I had back in 2021: <i>Mind Behind the Lens</i>. I’ve always enjoyed pairing text with visual media. The same is true even now, a few years past my collegiate endeavors and much further along in my development as an artist. Only, now I have much more to pair with text –– venture, a subset of this journal, dedicated specifically to hiking/backpacking and other wilderness and international travels; any and all of my work in cognitive science; my photography; and anything else that may come in time. The goal –– as it has always been –– is to commit to these entries without pressing the mental Alt+F4 when my aesthetic or motivation eventually changes.</p>\n  <p>For now, I’ve got much to write about, and much of a mind to do it.</p>\n  <p>I hope you’ll visit on occasion. Maybe something I say will afford you a greater scope for imagination in your own life.</p>\n  <p>Cheers,<br>\n    ~ Aaron</p>"
}
